{
  "$schema": "https://json-schema.org/draft/2020-12/schema",
  "$id": "kp/teil.schema.json",
  "title": "Fertigungsteil mit Bearbeitungen",
  "type": "object",
  "required": [
    "uid",
    "rolle",
    "material",
    "fertigmass",
    "bearbeitungen"
  ],
  "properties": {
    "uid": {
      "type": "string",
      "description": "Stabil über Neugenerierung: <projekt>/<pos>/<teil-id>"
    },
    "pos": {
      "type": "string",
      "description": "Schrankposition, z. B. 'A2'"
    },
    "teil_id": {
      "type": "string",
      "description": "id aus der Vorlage, z. B. 'sl'"
    },
    "rolle": {
      "$ref": "common.schema.json#/$defs/rolle"
    },
    "bezeichnung": {
      "type": "string",
      "description": "z. B. 'A2 Seite links'"
    },
    "material": {
      "type": "string"
    },
    "fertigmass": {
      "$ref": "#/$defs/mass3",
      "description": "L x W x D inkl. Anleimer (Konstruktionsmaß in SketchUp)"
    },
    "zuschnittmass": {
      "$ref": "#/$defs/mass3",
      "description": "Optional; sonst rechnet OCL"
    },
    "maserung": {
      "enum": [
        "laenge",
        "breite",
        "keine"
      ]
    },
    "kanten": {
      "type": "object",
      "propertyNames": {
        "$ref": "common.schema.json#/$defs/kantenseite"
      },
      "additionalProperties": {
        "type": [
          "string",
          "null"
        ]
      }
    },
    "sichtseite": {
      "$ref": "common.schema.json#/$defs/flaeche"
    },
    "wenden": {
      "type": "boolean",
      "description": "true, wenn Bearbeitungen auf F1 und F2 nötig sind (zweite Aufspannung)"
    },
    "bearbeitungen": {
      "type": "array",
      "items": {
        "$ref": "#/$defs/bearbeitung"
      }
    },
    "herkunft": {
      "type": "object",
      "properties": {
        "vorlage": {
          "type": "string"
        },
        "generator_version": {
          "type": "string"
        },
        "erzeugt": {
          "type": "string",
          "format": "date-time"
        },
        "hash": {
          "type": "string",
          "description": "Prüfsumme der Eingaben, erkennt manuelle Änderungen"
        }
      }
    },
    "kantenstaerke": {
      "type": "object",
      "description": "Aufgelöste Anleimerstärke je Seite in mm (0 oder fehlend = keine Kante). Der TCN-Export zieht sie vom Fertigmaß ab: Fräsmaß = Fertigmaß − Anleimer",
      "propertyNames": {
        "$ref": "common.schema.json#/$defs/kantenseite"
      },
      "additionalProperties": {
        "type": "number",
        "minimum": 0
      }
    },
    "lage": {
      "type": "object",
      "description": "Lage des Teils im Schrank-System (nur für SketchUp, nicht für den Export)",
      "required": [
        "position",
        "ausrichtung"
      ],
      "properties": {
        "position": {
          "type": "array",
          "items": {
            "type": "number"
          },
          "minItems": 3,
          "maxItems": 3
        },
        "ausrichtung": {
          "type": "object",
          "required": [
            "x",
            "z"
          ],
          "properties": {
            "x": {
              "enum": [
                "+x",
                "-x",
                "+y",
                "-y",
                "+z",
                "-z"
              ]
            },
            "z": {
              "enum": [
                "+x",
                "-x",
                "+y",
                "-y",
                "+z",
                "-z"
              ]
            }
          }
        }
      }
    },
    "ocl": {
      "type": "object",
      "description": "Daten für OpenCutList (Material, Kantenmaterial je Seite, Etikettentext)",
      "properties": {
        "material": {
          "type": "string",
          "description": "Name des SketchUp-Materials, das OCL als Teilematerial liest"
        },
        "farbe": {
          "type": [
            "string",
            "null"
          ],
          "pattern": "^#[0-9a-fA-F]{6}$"
        },
        "kanten": {
          "type": "object",
          "propertyNames": {
            "$ref": "common.schema.json#/$defs/kantenseite"
          },
          "additionalProperties": {
            "type": [
              "string",
              "null"
            ],
            "description": "Name des Kantenmaterials (SketchUp), null = keine Kante"
          }
        },
        "beschreibung": {
          "type": "string",
          "description": "Text für Etiketten, inkl. Kantenpositionen"
        }
      }
    }
  },
  "$defs": {
    "mass3": {
      "type": "object",
      "required": [
        "l",
        "w",
        "d"
      ],
      "properties": {
        "l": {
          "type": "number"
        },
        "w": {
          "type": "number"
        },
        "d": {
          "type": "number"
        }
      }
    },
    "basis": {
      "type": "object",
      "required": [
        "typ",
        "flaeche"
      ],
      "properties": {
        "id": {
          "type": "string"
        },
        "flaeche": {
          "$ref": "common.schema.json#/$defs/flaeche"
        },
        "quelle": {
          "type": "object",
          "description": "Woher die Bearbeitung kommt; für Rückverfolgung und Kollisionsmeldungen",
          "properties": {
            "regel": {
              "type": "string"
            },
            "beschlag": {
              "type": "string"
            },
            "partner_uid": {
              "type": "string",
              "description": "Gegenstück der Verbindung"
            }
          }
        },
        "werkzeug": {
          "type": [
            "string",
            "integer"
          ],
          "description": "Optional; Werkzeugname oder TpaCAD-Werkzeugnummer (#205), sonst wählt das Exporter-Profil"
        },
        "gruppe": {
          "type": "string",
          "description": "Zusammengehörige Bearbeitungen, z. B. ein Topfband"
        }
      }
    },
    "bearbeitung": {
      "oneOf": [
        {
          "$ref": "#/$defs/bohrung"
        },
        {
          "$ref": "#/$defs/bohrreihe"
        },
        {
          "$ref": "#/$defs/nut"
        },
        {
          "$ref": "#/$defs/tasche"
        },
        {
          "$ref": "#/$defs/kontur"
        },
        {
          "$ref": "#/$defs/saegeschnitt"
        },
        {
          "$ref": "#/$defs/makro"
        }
      ]
    },
    "bohrung": {
      "allOf": [
        {
          "$ref": "#/$defs/basis"
        }
      ],
      "properties": {
        "typ": {
          "const": "bohrung"
        },
        "x": {
          "type": "number"
        },
        "y": {
          "type": "number"
        },
        "z": {
          "type": "number",
          "description": "Nur Kantenbohrung (F3-F6): Höhe in der Dicke"
        },
        "d": {
          "type": "number",
          "exclusiveMinimum": 0
        },
        "tiefe": {
          "type": "number"
        },
        "durch": {
          "type": "boolean",
          "default": false
        },
        "senkung": {
          "type": "object",
          "properties": {
            "d": {
              "type": "number"
            },
            "tiefe": {
              "type": "number"
            }
          }
        }
      },
      "required": [
        "typ",
        "d",
        "tiefe"
      ]
    },
    "bohrreihe": {
      "allOf": [
        {
          "$ref": "#/$defs/basis"
        }
      ],
      "properties": {
        "typ": {
          "const": "bohrreihe"
        },
        "start": {
          "type": "array",
          "items": {
            "type": "number"
          },
          "minItems": 2,
          "maxItems": 2
        },
        "richtung": {
          "enum": [
            "+x",
            "-x",
            "+y",
            "-y"
          ]
        },
        "raster": {
          "type": "number"
        },
        "anzahl": {
          "type": "integer",
          "minimum": 1,
          "description": "Nicht nötig bei ausgemittelt"
        },
        "d": {
          "type": "number"
        },
        "tiefe": {
          "type": "number"
        },
        "ausgemittelt": {
          "type": "boolean",
          "default": false,
          "description": "Maschine verteilt gleichmäßig zwischen start und ende mit höchstens raster Abstand (TpaCAD CP)"
        },
        "gerade_anzahl": {
          "type": "boolean",
          "default": false,
          "description": "Nur mit ausgemittelt: immer gerade Anzahl (TpaCAD QP)"
        },
        "ende": {
          "type": "number",
          "description": "Nur mit ausgemittelt: Endkoordinate entlang der Richtung (Mindestabstand zum Rand)"
        },
        "durch": {
          "type": "boolean",
          "default": false
        }
      },
      "required": [
        "typ",
        "start",
        "richtung",
        "raster",
        "d",
        "tiefe"
      ],
      "if": {
        "not": {
          "properties": {
            "ausgemittelt": {
              "const": true
            }
          },
          "required": [
            "ausgemittelt"
          ]
        }
      },
      "then": {
        "required": [
          "anzahl"
        ]
      },
      "else": {
        "required": [
          "ende"
        ]
      }
    },
    "nut": {
      "allOf": [
        {
          "$ref": "#/$defs/basis"
        }
      ],
      "properties": {
        "typ": {
          "const": "nut"
        },
        "von": {
          "type": "array",
          "items": {
            "type": "number"
          },
          "minItems": 2,
          "maxItems": 2
        },
        "bis": {
          "type": "array",
          "items": {
            "type": "number"
          },
          "minItems": 2,
          "maxItems": 2
        },
        "breite": {
          "type": "number"
        },
        "tiefe": {
          "type": "number"
        },
        "bezug": {
          "enum": [
            "mitte",
            "links",
            "rechts"
          ],
          "default": "mitte",
          "description": "Lage von von/bis zur Nutbreite"
        },
        "ausfuehrung": {
          "enum": [
            "saege",
            "fraeser",
            "egal"
          ],
          "default": "egal"
        },
        "durchgehend": {
          "type": "boolean",
          "default": true
        }
      },
      "required": [
        "typ",
        "von",
        "bis",
        "breite",
        "tiefe"
      ]
    },
    "tasche": {
      "allOf": [
        {
          "$ref": "#/$defs/basis"
        }
      ],
      "properties": {
        "typ": {
          "const": "tasche"
        },
        "x": {
          "type": "number"
        },
        "y": {
          "type": "number"
        },
        "laenge": {
          "type": "number"
        },
        "breite": {
          "type": "number"
        },
        "tiefe": {
          "type": "number"
        },
        "eckradius": {
          "type": "number",
          "default": 0
        },
        "winkel": {
          "type": "number",
          "default": 0
        }
      },
      "required": [
        "typ",
        "x",
        "y",
        "laenge",
        "breite",
        "tiefe"
      ]
    },
    "kontur": {
      "allOf": [
        {
          "$ref": "#/$defs/basis"
        }
      ],
      "properties": {
        "typ": {
          "const": "kontur"
        },
        "pfad": {
          "type": "array",
          "items": {
            "type": "object",
            "required": [
              "x",
              "y"
            ],
            "properties": {
              "x": {
                "type": "number"
              },
              "y": {
                "type": "number"
              },
              "bogen": {
                "type": "object",
                "properties": {
                  "r": {
                    "type": "number"
                  },
                  "cw": {
                    "type": "boolean"
                  }
                }
              }
            }
          },
          "minItems": 2
        },
        "geschlossen": {
          "type": "boolean",
          "default": false
        },
        "tiefe": {
          "type": "number"
        },
        "korrektur": {
          "enum": [
            "links",
            "rechts",
            "keine"
          ],
          "default": "keine"
        }
      },
      "required": [
        "typ",
        "pfad",
        "tiefe"
      ]
    },
    "saegeschnitt": {
      "allOf": [
        {
          "$ref": "#/$defs/basis"
        }
      ],
      "properties": {
        "typ": {
          "const": "saegeschnitt"
        },
        "von": {
          "type": "array",
          "items": {
            "type": "number"
          },
          "minItems": 2,
          "maxItems": 2
        },
        "bis": {
          "type": "array",
          "items": {
            "type": "number"
          },
          "minItems": 2,
          "maxItems": 2
        },
        "tiefe": {
          "type": "number"
        },
        "neigung": {
          "type": "number",
          "default": 0
        }
      },
      "required": [
        "typ",
        "von",
        "bis",
        "tiefe"
      ]
    },
    "makro": {
      "allOf": [
        {
          "$ref": "#/$defs/basis"
        }
      ],
      "description": "Maschinenmakro der Werkstatt (TpaCAD #8098=...tmcr), Parameter werden unverändert durchgereicht",
      "properties": {
        "typ": {
          "const": "makro"
        },
        "nummer": {
          "type": "integer",
          "description": "W#-Nummer, z. B. 1001, 1003, 1506"
        },
        "datei": {
          "type": "string",
          "description": "Makroname ohne .tmcr, z. B. fittingx"
        },
        "parameter": {
          "type": "object",
          "propertyNames": {
            "pattern": "^[0-9]+$"
          },
          "additionalProperties": {
            "type": [
              "number",
              "string"
            ],
            "description": "Zahl oder TpaCAD-Ausdruck mit x, y, s"
          }
        }
      },
      "required": [
        "typ",
        "nummer",
        "datei"
      ]
    }
  }
}
